pmid,pmcid,doi,title,authors,year,month,day,journal,volume,issue,pages,abstract
18975148,PMC2743139,10.1007/s12021-008-9032-z,The NIFSTD and BIRNLex vocabularies: building comprehensive ontologies for neuroscience.,"['Bug WJ', 'Ascoli GA', 'Grethe JS', 'Gupta A', 'Fennema-Notestine C', 'Laird AR', 'Larson SD', 'Rubin D', 'Shepherd GM', 'Turner JA', 'Martone ME']",2008,9,20,Neuroinformatics,6,3,175-94,"A critical component of the Neuroscience Information Framework (NIF) project is a consistent, flexible terminology for describing and retrieving neuroscience-relevant resources. Although the original NIF specification called for a loosely structured controlled vocabulary for describing neuroscience resources, as the NIF system evolved, the requirement for a formally structured ontology for neuroscience with sufficient granularity to describe and access a diverse collection of information became obvious. This requirement led to the NIF standardized (NIFSTD) ontology, a comprehensive collection of common neuroscience domain terminologies woven into an ontologically consistent, unified representation of the biomedical domains typically used to describe neuroscience data (e.g., anatomy, cell types, techniques), as well as digital resources (tools, databases) being created throughout the neuroscience community. NIFSTD builds upon a structure established by the BIRNLex, a lexicon of concepts covering clinical neuroimaging research developed by the Biomedical Informatics Research Network (BIRN) project. Each distinct domain module is represented using the Web Ontology Language (OWL). As much as has been practical, NIFSTD reuses existing community ontologies that cover the required biomedical domains, building the more specific concepts required to annotate NIF resources. By following this principle, an extensive vocabulary was assembled in a relatively short period of time for NIF information annotation, organization, and retrieval, in a form that promotes easy extension and modification. We report here on the structure of the NIFSTD, and its predecessor BIRNLex, the principles followed in its construction and provide examples of its use within NIF."
18511305,PMC2592684,10.1016/j.neuroimage.2008.04.025,Functional neuroimaging correlates of finger-tapping task variations: an ALE meta-analysis.,"['Witt ST', 'Laird AR', 'Meyerand ME']",2008,8,1,Neuroimage,42,1,343-56,"Finger-tapping tasks are one of the most common paradigms used to study the human motor system in functional neuroimaging studies. These tasks can vary both in the presence or absence of a pacing stimulus as well as in the complexity of the tapping task. A voxel-wise, coordinate-based meta-analysis was performed on 685 sets of activation foci in Talairach space gathered from 38 published studies employing finger-tapping tasks. Clusters of concordance were identified within the primary sensorimotor cortices, supplementary motor area, premotor cortex, inferior parietal cortices, basal ganglia, and anterior cerebellum. Subsequent analyses performed on subsets of the primary set of foci demonstrated that the use of a pacing stimulus resulted in a larger, more diverse network of concordance clusters, in comparison to varying the complexity of the tapping task. The majority of the additional concordance clusters occurred in regions involved in the temporal aspects of the tapping task, rather than its execution. Tapping tasks employing a visual pacing stimulus recruited a set of nodes distinct from the results observed in those tasks employing either an auditory or no pacing stimulus, suggesting differing cognitive networks when integrating visual or auditory pacing stimuli into simple motor tasks. The relatively uniform network of concordance clusters observed across the more complex finger-tapping tasks suggests that further complexity, beyond the use of multi-finger sequences or bimanual tasks, may be required to fully reveal those brain regions necessary to execute truly complex movements."
18486104,PMC5441233,10.1016/j.biopsych.2008.03.031,Meta-analysis of gray matter anomalies in schizophrenia: application of anatomic likelihood estimation and network analysis.,"['Glahn DC', 'Laird AR', 'Ellison-Wright I', 'Thelen SM', 'Robinson JL', 'Lancaster JL', 'Bullmore E', 'Fox PT']",2008,11,1,Biol Psychiatry,64,9,774-81,"BACKGROUND: Although structural neuroimaging methods have been widely used to study brain morphology in schizophrenia, synthesizing this literature has been difficult. With the increasing popularity of voxel-based morphometric (VBM) methods in which group differences are reported in standardized coordinates, it is possible to apply powerful meta-analytic techniques initially designed for functional neuroimaging. In this study, we performed a voxelwise, coordinate-based meta-analysis to better conceptualize the neuroanatomic correlates of schizophrenia. METHODS: Thirty-one peer-reviewed articles, with a total of 1195 patients with schizophrenia contrasted with 1262 healthy volunteers, were included in the meta-analysis. Coordinates from each article were used to create a statistical map that estimated the likelihood of between-group gray matter density differences at every brain voxel. These results were subsequently entered into a network analysis. RESULTS: Patients had reduced gray matter density relative to control subjects in a distributed network of regions, including bilateral insular cortex, anterior cingulate, left parahippocampal gyrus, left middle frontal gyrus, postcentral gyrus, and thalamus. Network analysis grouped these regions into four distinct networks that potentially represent different pathologic processes. Patients had increased gray matter density in striatal regions. CONCLUSIONS: This study expands on previous meta-analyses of the neuroanatomy of schizophrenia by elucidating a series of brain networks disrupted by the illness. Because it is possible that these networks are influenced by independent etiologic factors, this work should foster more detailed neural models of the illness and focus research designed to discover the mechanisms of gray matter reduction in schizophrenia."
18387823,PMC2871686,10.1016/j.neuroimage.2008.01.065,Modeling motor connectivity using TMS/PET and structural equation modeling.,"['Laird AR', 'Robbins JM', 'Li K', 'Price LR', 'Cykowski MD', 'Narayana S', 'Laird RW', 'Franklin C', 'Fox PT']",2008,6,20,Neuroimage,41,2,424-36,"Structural equation modeling (SEM) was applied to positron emission tomographic (PET) images acquired during transcranial magnetic stimulation (TMS) of the primary motor cortex (M1(hand)). TMS was applied across a range of intensities, and responses both at the stimulation site and remotely connected brain regions covaried with stimulus intensity. Regions of interest (ROIs) were identified through an activation likelihood estimation (ALE) meta-analysis of TMS studies. That these ROIs represented the network engaged by motor planning and execution was confirmed by an ALE meta-analysis of finger movement studies. Rather than postulate connections in the form of an a priori model (confirmatory approach), effective connectivity models were developed using a model-generating strategy based on improving tentatively specified models. This strategy exploited the experimentally imposed causal relations: (1) that response variations were caused by stimulation variations, (2) that stimulation was unidirectionally applied to the M1(hand) region, and (3) that remote effects must be caused, either directly or indirectly, by the M1(hand) excitation. The path model thus derived exhibited an exceptional level of goodness (chi(2)=22.150, df=38, P=0.981, TLI=1.0). The regions and connections derived were in good agreement with the known anatomy of the human and primate motor system. The model-generating SEM strategy thus proved highly effective and successfully identified a complex set of causal relationships of motor connectivity."
18381902,PMC2873788,10.1176/appi.ajp.2008.07101562,The anatomy of first-episode and chronic schizophrenia: an anatomical likelihood estimation meta-analysis.,"['Ellison-Wright I', 'Glahn DC', 'Laird AR', 'Thelen SM', 'Bullmore E']",2008,8,20,Am J Psychiatry,165,8,1015-23,"OBJECTIVE: The authors sought to map gray matter changes in first-episode schizophrenia and to compare these with the changes in chronic schizophrenia. They postulated that the data would show a progression of changes from hippocampal deficits in first-episode schizophrenia to include volume reductions in the amygdala and cortical gray matter in chronic schizophrenia. METHOD: A systematic search was conducted for voxel-based structural MRI studies of patients with first-episode schizophrenia and chronic schizophrenia in relation to comparison groups. Meta-analyses of the coordinates of gray matter differences were carried out using anatomical likelihood estimation. Maps of gray matter changes were constructed, and subtraction meta-analysis was used to compare them. RESULTS: A total of 27 articles were identified for inclusion in the meta-analyses. A marked correspondence was observed in regions affected by both first-episode schizophrenia and chronic schizophrenia, including gray matter decreases in the thalamus, the left uncus/amygdala region, the insula bilaterally, and the anterior cingulate. In the comparison of first-episode schizophrenia and chronic schizophrenia, decreases in gray matter volume were detected in first-episode schizophrenia but not in chronic schizophrenia in the caudate head bilaterally; decreases were more widespread in cortical regions in chronic schizophrenia. CONCLUSIONS: Anatomical changes in first-episode schizophrenia broadly coincide with a basal ganglia-thalamocortical circuit. These changes include bilateral reductions in caudate head gray matter, which are absent in chronic schizophrenia. Comparing first-episode schizophrenia and chronic schizophrenia, the authors did not find evidence for the temporolimbic progression of pathology from hippocampus to amygdala, but there was evidence for progression of cortical changes."
18071195,PMC2733306,10.1093/cercor/bhm224,The central sulcus: an observer-independent characterization of sulcal landmarks and depth asymmetry.,"['Cykowski MD', 'Coulon O', 'Kochunov PV', 'Amunts K', 'Lancaster JL', 'Laird AR', 'Glahn DC', 'Fox PT']",2008,9,20,Cereb Cortex,18,9,1999-2009,"Studies of the central sulcus (CS) often use observer-dependent procedures to assess CS morphology and sulcal landmarks. Here, we applied a novel method combining automated sulcus reconstruction, surface parameterization, and an observer-independent depth measurement to study the CS. This facilitated the quantitative assessment of the spatial position and intersubject variability of several sulcal landmarks. Sulcal depth profiles also allowed us to develop an algorithm for the clear identification of several landmarks, including the pli de passage fronto-parietal moyen (PPFM), first described by Broca. Using this algorithm, the PPFM was identified in the majority of sulci, but exhibited limited spatial variability. This appears to support Cunningham's theory that this landmark may be a developmental remnant, and may argue against its role as a guide to the more variable somatotopic hand area. Sulcal depth profiles were also utilized to assess the influence of sex, handedness, and age on CS morphology. These profiles revealed leftward depth asymmetry in the superior extent of the CS of male subjects and near the midpoint of the CS in female subjects. Age correlations were performed for these asymmetries, and a significant correlation was seen only in the male subgroup."
18061263,PMC2889493,10.1016/j.neubiorev.2007.09.005,Integrating evidence from neuroimaging and neuropsychological studies of obsessive-compulsive disorder: the orbitofronto-striatal model revisited.,"['Menzies L', 'Chamberlain SR', 'Laird AR', 'Thelen SM', 'Sahakian BJ', 'Bullmore ET']",2008,10,20,Neurosci Biobehav Rev,32,3,525-49,"Obsessive-compulsive disorder (OCD) is a common, heritable and disabling neuropsychiatric disorder. Theoretical models suggest that OCD is underpinned by functional and structural abnormalities in orbitofronto-striatal circuits. Evidence from cognitive and neuroimaging studies (functional and structural magnetic resonance imaging (MRI) and positron emission tomography (PET)) have generally been taken to be supportive of these theoretical models; however, results from these studies have not been entirely congruent with each other. With the advent of whole brain-based structural imaging techniques, such as voxel-based morphometry and multivoxel analyses, we consider it timely to assess neuroimaging findings to date, and to examine their compatibility with cognitive studies and orbitofronto-striatal models. As part of this assessment, we performed a quantitative, voxel-level meta-analysis of functional MRI findings, which revealed consistent abnormalities in orbitofronto-striatal and other additional areas in OCD. This review also considers the evidence for involvement of other brain areas outside orbitofronto-striatal regions in OCD, the limitations of current imaging techniques, and how future developments in imaging may aid our understanding of OCD."
17598168,PMC2873772,10.1002/hbm.20426,A meta-analytic study of changes in brain activation in depression.,"['Fitzgerald PB', 'Laird AR', 'Maller J', 'Daskalakis ZJ']",2008,6,20,Hum Brain Mapp,29,6,683-95,"OBJECTIVE: A large number of studies with considerably variable methods have been performed to investigate brain regions involved in the pathophysiology of major depressive disorder. The aim of this study was to use a quantitative meta-analytic technique to synthesise the results of much of this research. METHODS: Three separate quantitative meta-analytical studies were conducted using the Activation Likelihood Estimation technique. Analysis was performed on three types of studies: (1) those conducted at rest comparing brain activation in patients with depression and controls; (2) those involving brain changes following antidepressant treatment; and (3) those comparing brain activation patterns induced by the induction of positive or negative emotion in patients with depression compared with controls. RESULTS: There appears to be a complex series of areas of the brain implicated in the pathophysiology of depression although limited overlap was found across imaging paradigms. This included a network of regions including frontal and temporal cortex as well as the insula and cerebellum that are hypoactive in depressed subjects and in which there is increase in activity with treatment. There was a corresponding set of subcortical and limbic regions in which opposite changes were found. CONCLUSIONS: There is limited overlap between the brain regions identified using differing imaging methods. The most consistently identified regions include areas of the anterior cingulate, dorsolateral, medial and inferior prefrontal cortex, insula, superior temporal gyrus, basal ganglia and cerebellum. Further research is required to identify if different imaging methods are identifying complementary networks that are equally involved in the disorder."
17441252,,10.1118/1.2558301,An objective method for combining multi-parametric MRI datasets to characterize malignant tumors.,"['McMillan KM', 'Rogers BP', 'Koay CG', 'Laird AR', 'Price RR', 'Meyerand ME']",2007,3,20,Med Phys,34,3,1053-61,"Medical imaging has made significant contributions to the characterization of malignant tumors. In many cases, however, maps from multiple modalities may be required for more complete tumor mapping. In this manuscript we propose an objective method for combining multiple imaging datasets with the goal of characterizing malignant tumors. We refer to the proposed technique as the percent overlap method (POM). To demonstrate the power and flexibility of the POM analysis, we present four patients with recurrent glioblastoma multiforme. Each patient had multiple magnetic resonance imaging procedures resulting in seven different parameter maps. Chemical shift imaging was used to provide three metabolite ratio maps (Cho:NAA, Cho:Cre, Lac:Cre). A perfusion scan provided regional cerebral blood volume and permeability maps. Diffusion and carbogen-based hypoxia mapping data were also acquired. Composite maps were formed for each patient using POM, then were compared to results from the ISODATA clustering technique. The POM maps of likely recurrent tumor regions were found to be consistent with the ISODATA clustering method. This manuscript presents an objective method for combining parameters from multiple physiologic imaging techniques into a single composite map. The accuracy of the map depends strongly on the sensitivity of the chosen imaging parameters to the disease process at the time of image acquisition. Further validation of this method may be achieved by correlation with histological data."
17280644,PMC1868514,10.1016/j.brainres.2006.12.058,Self-paced working memory: validation of verbal variations of the n-back paradigm.,"['McMillan KM', 'Laird AR', 'Witt ST', 'Meyerand ME']",2007,3,30,Brain Res,1139,,133-42,"Self-paced versions of many paradigms could have utility in probing cognitive systems. To validate several self-paced n-back paradigms, fourteen subjects performed four variations of the working memory task using visually presented letters as stimuli. Several areas in the frontal lobe, the anterior cingulate and a parietal network were consistently activated in the four variations: identity of black letters, location of black letters, color of colored letters and identity of colored letters. Since the n-back task is one of the more popular methods of investigating working memory, we validated the utility of several self-paced versions in normal subjects via quantitative, coordinate-based meta-analyses. The self-paced results agree well with meta-analyses and other published results, giving confidence that a self-paced n-back paradigm is robust in multiple variations. Behavioral results differ from other published reports, perhaps offering insight into true working memory strategy in normal subjects."
17029760,,10.1016/j.pscychresns.2006.04.006,An analysis of functional neuroimaging studies of dorsolateral prefrontal cortical activity in depression.,"['Fitzgerald PB', 'Oxley TJ', 'Laird AR', 'Kulkarni J', 'Egan GF', 'Daskalakis ZJ']",2006,11,22,Psychiatry Res,148,1,33-45,"Repetitive transcranial magnetic stimulation (rTMS) is currently undergoing active investigation for use in the treatment of major depression. Recent research has indicated that current methods used to localize the site of stimulation in dorsolateral prefrontal cortex (DLPFC) are significantly inaccurate. However, little information is available on which to base a choice of stimulation site. The aim of the current study was to systematically examine imaging studies in depression to attempt to identify whether there is a pattern of imaging results that suggests an optimal site of stimulation localization. We analysed all imaging studies published prior to 2005 that examined patients with major depression. Studies reporting activation in DLPFC were identified. The DLPFC regions identified in these studies were analysed using the Talairach and Rajkowska-Goldman-Rakic coordinate systems. In addition, we conducted a quantitative meta-analysis of resting studies and studies of serotonin reuptake inhibitor antidepressant treatment. There was considerable heterogeneity in the results between studies. Changes in Brodmann area 9 were relatively consistently identified in resting, cognitive activation and treatment studies included in the meta-analysis. However, there was little consistency in the direction of these changes or the hemisphere in which they were identified. At this stage, the results of imaging studies published to date have limited capacity to inform the choice of optimal prefrontal cortical region for the use in rTMS treatment studies."
16997706,,10.1016/j.jocn.2005.12.025,"Physiologic characterisation of glioblastoma multiforme using MRI-based hypoxia mapping, chemical shift imaging, perfusion and diffusion maps.","['McMillan KM', 'Rogers BP', 'Field AS', 'Laird AR', 'Fine JP', 'Meyerand ME']",2006,10,20,J Clin Neurosci,13,8,811-7,"PURPOSE: A multiparametric, physiologic MRI approach was considered to more completely characterise biopsy-confirmed glioblastoma multiforme (GBM). Chemical shift imaging (CSI) supplied biochemical information in metabolite ratios, while perfusion images provided data on presumed vascularity from regional cerebral blood volume (rCBV) and permeability maps. Diffusion-weighted images were reduced to apparent diffusion coefficient (ADC) maps to evaluate cellularity, and blood oxygen level-dependent imaging was used to create maps of putative hypoxic regions. METHODS: Six post-treatment GBM patients were scanned at 3-month intervals until recurrence was suggested by conventional MRI parameters, yielding 20 scans for consideration. The percentage of extreme values in each technique that overlapped with other parameters was measured and compared across hemispheres to assess utility. RESULTS: We found significantly better performance in selecting the diseased hemisphere for overall percent overlap when compared to voxel counts from individual thresholded parameter maps. Parameters were selected on the basis of highest overlap, and corresponding composite overlap maps show increased specificity to likely recurrent regions by reducing the number of falsely positive voxels, and offer insight into relationships between various parameters. CONCLUSION: In a pilot group of patients, percent overlap appears to be sensitive to recurrent disease. When used to combine multiple parameters, voxels containing overlap can specifically target probable recurrent areas."
16628607,,10.1002/hbm.20235,Retrospective motion correction protocol for high-resolution anatomical MRI.,"['Kochunov P', 'Lancaster JL', 'Glahn DC', 'Purdy D', 'Laird AR', 'Gao F', 'Fox P']",2006,12,20,Hum Brain Mapp,27,12,957-62,"Modern computational brain morphology methods require that anatomical images be acquired at high resolution and with a high signal-to-noise ratio. This often translates into long acquisition times (>20 minutes) and images susceptible to head motion. In this study we tested retrospective motion correction (RMC), common for functional MRI (fMRI) and PET image motion correction, as a means to improve the quality of high-resolution 3-D anatomical MR images. RMC methods are known to be effective for correcting interscan motion; therefore, a single high-resolution 3-D MRI brain study was divided into six shorter acquisition segments to help shift intrascan motion into interscan motion. To help reduce intrascan head motion, each segment image was reviewed for motion artifacts and repeated if necessary. Interscan motion correction was done by spatially registering images to the third image and forming a single average motion-corrected image. RMC was tested on 35 subjects who were considered at high risk for head motion. Our results show that RMC provided better contrast-to-noise ratio and boundary detail when compared to nonmotion-corrected averaged images."
16088798,,10.1086/431499,Serotype diversity and reassortment between human and animal rotavirus strains: implications for rotavirus vaccine programs.,"['Gentsch JR', 'Laird AR', 'Bielfelt B', 'Griffin DD', 'Banyai K', 'Ramachandran M', 'Jain V', 'Cunliffe NA', 'Nakagomi O', 'Kirkwood CD', 'Fischer TK', 'Parashar UD', 'Bresee JS', 'Jiang B', 'Glass RI']",2005,9,1,J Infect Dis,192 Suppl 1,,S146-59,"The development of rotavirus vaccines that are based on heterotypic or serotype-specific immunity has prompted many countries to establish programs to assess the disease burden associated with rotavirus infection and the distribution of rotavirus strains. Strain surveillance helps to determine whether the most prevalent local strains are likely to be covered by the serotype antigens found in current vaccines. After introduction of a vaccine, this surveillance could detect which strains might not be covered by the vaccine. Almost 2 decades ago, studies demonstrated that 4 globally common rotavirus serotypes (G1-G4) represent >90% of the rotavirus strains in circulation. Subsequently, these 4 serotypes were used in the development of reassortant vaccines predicated on serotype-specific immunity. More recently, the application of reverse-transcription polymerase chain reaction genotyping, nucleotide sequencing, and antigenic characterization methods has confirmed the importance of the 4 globally common types, but a much greater strain diversity has also been identified (we now recognize strains with at least 42 P-G combinations). These studies also identified globally (G9) or regionally (G5, G8, and P2A[6]) common serotype antigens not covered by the reassortant vaccines that have undergone efficacy trials. The enormous diversity and capacity of human rotaviruses for change suggest that rotavirus vaccines must provide good heterotypic protection to be optimally effective."
